{
  "benchmark": "SPY",
  "benchmark_spark": [
    679.8932,
    680.9902,
    684.4208,
    682.6157,
    687.5523,
    680.5315,
    685.4779,
    691.2622,
    687.4226,
    684.1216,
    684.5106,
    678.4771,
    683.264,
    679.4544,
    670.5487,
    676.4227,
    675.3356,
    674.488,
    664.2459,
    660.4862,
    667.2079,
    668.963,
    659.6285,
    658.003,
    648.57,
    655.38,
    653.18,
    656.82,
    645.09,
    634.09,
    631.97,
    650.34,
    655.24,
    655.83,
    658.93,
    659.22,
    676.01,
    679.91,
    679.46,
    686.1,
    694.46,
    699.94,
    701.66,
    710.14,
    708.72,
    704.08,
    711.21,
    708.45,
    713.94,
    715.17,
    711.69,
    711.58,
    718.66,
    720.65,
    718.01,
    723.77,
    733.83,
    731.58,
    737.62,
    739.3
  ],
  "errors": [
    {
      "stage": "yfinance",
      "ticker": "MRVL",
      "warn": "too few rows for MRVL: 0"
    },
    {
      "error": "yfinance + stooq + cache all failed",
      "stage": "fetch",
      "ticker": "MRVL"
    }
  ],
  "fx_eur_usd": 1.1769,
  "generated_at": "2026-05-11T23:30:10Z",
  "holdings_summary": [
    {
      "action": "HOLD",
      "score": 57,
      "ticker": "NBIS"
    },
    {
      "action": "HOLD",
      "score": 56,
      "ticker": "IREN"
    },
    {
      "action": "HOLD",
      "score": 52,
      "ticker": "GOOG"
    },
    {
      "action": "HOLD",
      "score": 51,
      "ticker": "NVDA"
    },
    {
      "action": "HOLD",
      "score": 45,
      "ticker": "IONQ"
    }
  ],
  "model_version": 2,
  "over_concentrated_sectors": [
    "AI Infra"
  ],
  "params": {
    "risk": {
      "earnings_block_days": 3,
      "hard_stop_pct": 0.85,
      "max_position_pct": 0.3,
      "per_trade": 0.01,
      "sector_warn_pct": 0.4,
      "stop_mult": 2.0
    },
    "rs_window": 126,
    "rsi_window": 14,
    "sma_fast": 50,
    "sma_slow": 200,
    "weights": {
      "trend_centered": 0.2,
      "z_macd_pos": 0.05,
      "z_mom_12_1": 0.3,
      "z_rs_6m": 0.15,
      "z_rsi_norm": 0.05,
      "z_vol_adj_ret": 0.25
    }
  },
  "portfolio": {
    "by_holding": [
      {
        "cost_eur": 481.0,
        "pnl_eur": 2564.96,
        "pnl_pct": 5.3326,
        "ticker": "IREN",
        "value_eur": 3045.96
      },
      {
        "cost_eur": 423.5,
        "pnl_eur": 1315.92,
        "pnl_pct": 3.1073,
        "ticker": "NBIS",
        "value_eur": 1739.42
      },
      {
        "cost_eur": 826.0,
        "pnl_eur": 817.19,
        "pnl_pct": 0.9893,
        "ticker": "GOOG",
        "value_eur": 1643.19
      },
      {
        "cost_eur": 358.4,
        "pnl_eur": 1188.46,
        "pnl_pct": 3.316,
        "ticker": "IONQ",
        "value_eur": 1546.86
      },
      {
        "cost_eur": 660.0,
        "pnl_eur": 458.75,
        "pnl_pct": 0.6951,
        "ticker": "NVDA",
        "value_eur": 1118.75
      }
    ],
    "cost_eur": 2748.9,
    "pnl_eur": 6345.29,
    "pnl_pct": 2.3083,
    "value_eur": 9094.19
  },
  "ranked_avoid": [],
  "ranked_buys": [
    "AXTI",
    "AAOI",
    "MU",
    "WULF",
    "NBIS",
    "CIFR",
    "IREN",
    "VRT",
    "APLD",
    "RKLB"
  ],
  "regime": "RISK_ON",
  "regime_score": 52,
  "sector_concentration": {
    "AI Infra": 0.5262,
    "AI/Cloud": 0.1807,
    "Quantum": 0.1701,
    "Semis": 0.123
  },
  "tickers": {
    "AAOI": {
      "drawdown_vs_basis": null,
      "factor_contributions": {
        "macd": -0.79,
        "momentum": 4.87,
        "rs": 3.94,
        "rsi": 0.02,
        "trend": 2.5,
        "vol_adj": 3.12
      },
      "holding_action": null,
      "indicators": {
        "atr14": 20.9181,
        "breakout_20d": true,
        "donchian_high_20": 183.51,
        "macd_hist": -0.8614,
        "mom_12_1": 13.0748,
        "near_sma_fast": false,
        "rs_6m": 5.2447,
        "rsi14": 61.12,
        "sma200": 55.6489,
        "sma50": 127.3754,
        "trend_ok": true,
        "vol_63d_ann": 1.6903
      },
      "is_holding": false,
      "is_pullback": false,
      "name": "AAOI",
      "next_earnings": null,
      "next_earnings_in_days": null,
      "price_eur": 157.1095,
      "price_usd": 184.9,
      "prior_action": null,
      "prior_verdict": "WATCH",
      "score": 64,
      "score_delta_1d": 3,
      "score_delta_5d": null,
      "sector": "AI Infra",
      "sentiment": {
        "analyst": {
          "as_of": "2026-05-11T23:30:07Z",
          "key": "buy",
          "n_analysts": 5,
          "score": 1,
          "target_upside_pct": -0.1817
        },
        "news": {
          "as_of": "2026-05-11T23:30:07Z",
          "compound": 0.0443,
          "label": "NEUTRAL",
          "n_headlines": 10
        }
      },
      "spark": [
        44.46,
        43.91,
        43.44,
        46.98,
        51.68,
        53.96,
        56.27,
        58.12,
        53.69,
        84.23,
        102.51,
        95.34,
        99.71,
        101.14,
        95.58,
        110.62,
        120.49,
        127.01,
        106.19,
        96.81,
        94.07,
        86.33,
        92.63,
        101.92,
        87.54,
        95.76,
        113.9,
        114.41,
        97.42,
        98.21,
        85.19,
        84.59,
        86.35,
        103.91,
        107.45,
        117.64,
        132.7,
        133.3,
        150.6,
        153.19,
        146.39,
        142.55,
        157.32,
        159.42,
        163.47,
        150.57,
        149.42,
        137.73,
        162.17,
        145.78,
        137.26,
        152.83,
        164.36,
        183.51,
        172.98,
        180.57,
        178.54,
        157.55,
        148.94,
        184.9
      ],
      "stop_loss_eur": null,
      "suggested_add_eur": null,
      "verdict": "WATCH",
      "weight": null
    },
    "AMD": {
      "drawdown_vs_basis": null,
      "factor_contributions": {
        "macd": 0.54,
        "momentum": -0.53,
        "rs": 0.21,
        "rsi": 0.62,
        "trend": 2.5,
        "vol_adj": -0.11
      },
      "holding_action": null,
      "indicators": {
        "atr14": 22.2864,
        "breakout_20d": true,
        "donchian_high_20": 455.19,
        "macd_hist": 11.3688,
        "mom_12_1": 2.1331,
        "near_sma_fast": false,
        "rs_6m": 0.8209,
        "rsi14": 81.09,
        "sma200": 218.8363,
        "sma50": 259.6826,
        "trend_ok": true,
        "vol_63d_ann": 0.6924
      },
      "is_holding": false,
      "is_pullback": false,
      "name": "AMD",
      "next_earnings": null,
      "next_earnings_in_days": null,
      "price_eur": 389.8339,
      "price_usd": 458.79,
      "prior_action": null,
      "prior_verdict": "WATCH",
      "score": 53,
      "score_delta_1d": 0,
      "score_delta_5d": null,
      "sector": "Semis",
      "sentiment": {
        "analyst": {
          "as_of": "2026-05-09T09:31:34Z",
          "key": "strongBuy",
          "n_analysts": 47,
          "score": 2,
          "target_upside_pct": -0.0487
        },
        "news": {
          "as_of": "2026-05-11T23:30:06Z",
          "compound": 0.1919,
          "label": "POS",
          "n_headlines": 10
        }
      },
      "spark": [
        207.32,
        203.08,
        200.12,
        203.37,
        200.15,
        196.6,
        213.84,
        210.86,
        203.68,
        200.21,
        198.62,
        190.95,
        202.07,
        199.45,
        192.43,
        202.68,
        203.23,
        204.83,
        197.74,
        193.39,
        196.58,
        196.31,
        199.46,
        205.27,
        201.33,
        202.68,
        205.37,
        220.27,
        203.77,
        201.99,
        196.04,
        203.43,
        210.21,
        217.5,
        220.18,
        221.53,
        231.82,
        236.64,
        245.04,
        246.83,
        255.07,
        258.12,
        278.26,
        278.39,
        274.95,
        284.49,
        303.46,
        305.33,
        347.81,
        334.63,
        323.21,
        337.11,
        354.49,
        360.54,
        341.54,
        355.26,
        421.39,
        408.46,
        455.19,
        458.79
      ],
      "stop_loss_eur": null,
      "suggested_add_eur": null,
      "verdict": "WATCH",
      "weight": null
    },
    "AMZN": {
      "drawdown_vs_basis": null,
      "factor_contributions": {
        "macd": -0.5,
        "momentum": -1.39,
        "rs": -0.48,
        "rsi": 0.54,
        "trend": 2.5,
        "vol_adj": -1.29
      },
      "holding_action": null,
      "indicators": {
        "atr14": 6.861,
        "breakout_20d": false,
        "donchian_high_20": 274.99,
        "macd_hist": -0.4105,
        "mom_12_1": 0.3968,
        "near_sma_fast": false,
        "rs_6m": -0.0024,
        "rsi14": 68.8,
        "sma200": 228.7081,
        "sma50": 232.4194,
        "trend_ok": true,
        "vol_63d_ann": 0.2862
      },
      "is_holding": false,
      "is_pullback": false,
      "name": "AMZN",
      "next_earnings": null,
      "next_earnings_in_days": null,
      "price_eur": 228.5608,
      "price_usd": 268.99,
      "prior_action": null,
      "prior_verdict": "WATCH",
      "score": 49,
      "score_delta_1d": -1,
      "score_delta_5d": null,
      "sector": "AI/Cloud",
      "sentiment": {
        "analyst": {
          "as_of": "2026-05-09T09:31:37Z",
          "key": "strongBuy",
          "n_analysts": 62,
          "score": 2,
          "target_upside_pct": 0.1398
        },
        "news": {
          "as_of": "2026-05-11T23:30:08Z",
          "compound": 0.042,
          "label": "NEUTRAL",
          "n_headlines": 10
        }
      },
      "spark": [
        198.79,
        201.15,
        204.79,
        204.86,
        210.11,
        205.27,
        208.56,
        210.64,
        207.92,
        210.0,
        208.39,
        208.73,
        216.82,
        218.94,
        213.21,
        213.49,
        214.33,
        212.65,
        209.53,
        207.67,
        211.74,
        215.2,